{
  "$schema": "https://json-schema.org/draft/2020-12/schema",
  "$id": "https://raw.githubusercontent.com/fullstack-ai-infra/digital-employee/main/configs/workspace-org.schema.json",
  "title": "workspace-org.v1 organization model",
  "type": "object",
  "additionalProperties": false,
  "required": [
    "schemaVersion",
    "business",
    "owner",
    "roles",
    "updatedAt"
  ],
  "properties": {
    "$schema": {
      "type": "string"
    },
    "schemaVersion": {
      "const": "workspace-org.v1"
    },
    "business": {
      "type": "string",
      "pattern": "^[a-z0-9]+(?:-[a-z0-9]+)*$",
      "maxLength": 64
    },
    "description": {
      "type": "string"
    },
    "owner": {
      "type": "string",
      "pattern": "^[a-z0-9]+(?:-[a-z0-9]+)*$",
      "maxLength": 64
    },
    "roles": {
      "type": "array",
      "minItems": 1,
      "items": {
        "type": "object",
        "additionalProperties": false,
        "required": [
          "id",
          "name",
          "description",
          "reportTo",
          "package",
          "memoryScope",
          "toolAllow",
          "toolDeny",
          "metadata",
          "budget"
        ],
        "properties": {
          "id": {
            "type": "string",
            "pattern": "^[a-z0-9]+(?:-[a-z0-9]+)*$",
            "maxLength": 64
          },
          "name": {
            "type": "string",
            "minLength": 1,
            "maxLength": 128
          },
          "description": {
            "type": "string",
            "maxLength": 2000
          },
          "reportTo": {
            "anyOf": [
              {
                "type": "null"
              },
              {
                "type": "string",
                "pattern": "^[a-z0-9]+(?:-[a-z0-9]+)*$",
                "maxLength": 64
              }
            ]
          },
          "package": {
            "type": "object",
            "additionalProperties": false,
            "required": [
              "name",
              "version",
              "digest",
              "localReference"
            ],
            "properties": {
              "name": {
                "type": "string",
                "minLength": 1
              },
              "version": {
                "type": "string",
                "minLength": 1
              },
              "digest": {
                "type": "string",
                "pattern": "^sha256:[a-f0-9]{64}$"
              },
              "localReference": {
                "type": "string",
                "minLength": 1
              }
            }
          },
          "mode": {
            "enum": [
              "read_only",
              "approval_required"
            ]
          },
          "memoryScope": {
            "type": "string",
            "minLength": 1
          },
          "toolAllow": {
            "type": "array",
            "items": {
              "type": "string",
              "minLength": 1,
              "maxLength": 64
            }
          },
          "toolDeny": {
            "type": "array",
            "items": {
              "type": "string",
              "minLength": 1,
              "maxLength": 64
            }
          },
          "metadata": {
            "type": "object",
            "additionalProperties": {
              "type": "string"
            }
          },
          "budget": {
            "$ref": "#/$defs/positionBudget"
          },
          "connectors": {
            "type": "object",
            "additionalProperties": false,
            "required": [
              "schemaVersion",
              "digest",
              "channels",
              "sources"
            ],
            "properties": {
              "schemaVersion": {
                "const": "position-connectors.v1"
              },
              "digest": {
                "type": "string",
                "pattern": "^sha256:[a-f0-9]{64}$"
              },
              "channels": {
                "$ref": "#/$defs/connectorBindings"
              },
              "sources": {
                "$ref": "#/$defs/connectorBindings"
              }
            }
          }
        }
      }
    },
    "updatedAt": {
      "type": "string",
      "minLength": 1
    }
  },
  "$defs": {
    "positionBudget": {
      "type": "object",
      "additionalProperties": false,
      "required": [
        "perTask",
        "perDay"
      ],
      "properties": {
        "perTask": {
          "$ref": "#/$defs/budgetScope"
        },
        "perDay": {
          "$ref": "#/$defs/budgetScope"
        }
      }
    },
    "budgetScope": {
      "type": "object",
      "additionalProperties": false,
      "minProperties": 1,
      "properties": {
        "tokens": {
          "type": "integer",
          "exclusiveMinimum": 0,
          "maximum": 1000000000
        },
        "iterations": {
          "type": "integer",
          "exclusiveMinimum": 0,
          "maximum": 1000000000
        }
      }
    },
    "connectorBinding": {
      "type": "object",
      "additionalProperties": false,
      "required": [
        "id"
      ],
      "properties": {
        "id": {
          "type": "string",
          "pattern": "^[a-z0-9](?:[a-z0-9._-]{0,127})$"
        },
        "env": {
          "type": "object",
          "additionalProperties": {
            "type": "string",
            "pattern": "^[A-Z][A-Z0-9_]{0,127}$"
          }
        }
      }
    },
    "connectorBindings": {
      "type": "array",
      "maxItems": 16,
      "items": {
        "$ref": "#/$defs/connectorBinding"
      }
    }
  }
}
