{
  "$schema": "https://raw.githubusercontent.com/bytefolk/digital-employee/main/configs/workspace-org.schema.json",
  "schemaVersion": "workspace-org.v1",
  "business": "github-ops",
  "description": "GitHub 运营团队：提交与评审分属不同岗位；评审使用独立身份，合并由操作者人工执行。",
  "owner": "issue-triage",
  "roles": [
    {
      "id": "issue-triage",
      "name": "问题调研",
      "description": "查重、复现并分流 issue，按目标仓库自己的模板创建新 issue 并给出证据分级。",
      "reportTo": null,
      "package": {
        "name": "issue-triage",
        "version": "0.1.0",
        "digest": "sha256:524c14e3c2c81ae01744bad3f1ca5d8fe2ea0fea922f1b4391d769921d96cb15",
        "localReference": "./positions/issue-triage"
      },
      "mode": "approval_required",
      "memoryScope": "/",
      "toolAllow": [
        "Read",
        "Grep",
        "Glob",
        "Bash"
      ],
      "toolDeny": [],
      "metadata": {},
      "budget": {
        "perTask": {
          "tokens": 20000,
          "iterations": 8
        },
        "perDay": {
          "tokens": 200000,
          "iterations": 64
        }
      }
    },
    {
      "id": "pr-author",
      "name": "提交",
      "description": "按 issue 实现改动、推分支并开 PR，按评审意见修改到通过；不批准、不合并任何 PR。",
      "reportTo": null,
      "package": {
        "name": "pr-author",
        "version": "0.1.0",
        "digest": "sha256:95d3cc5ce1b54ebe97da8902637a29ccbe9e4c395639b40c6ca55a174db7f9a9",
        "localReference": "./positions/pr-author"
      },
      "mode": "approval_required",
      "memoryScope": "/",
      "toolAllow": [
        "Read",
        "Write",
        "Edit",
        "Grep",
        "Glob",
        "Bash"
      ],
      "toolDeny": [],
      "metadata": {},
      "budget": {
        "perTask": {
          "tokens": 20000,
          "iterations": 8
        },
        "perDay": {
          "tokens": 200000,
          "iterations": 64
        }
      }
    },
    {
      "id": "pr-reviewer",
      "name": "评审",
      "description": "独立评审他人 PR 并给出批准或变更请求；只审判不合并，所用凭据不具备写基分支的能力。",
      "reportTo": null,
      "package": {
        "name": "pr-reviewer",
        "version": "0.1.0",
        "digest": "sha256:3e1c54c1703e13001a8fff41fb8ffb25897d1ad659fe561dd7182c4146ff1baa",
        "localReference": "./positions/pr-reviewer"
      },
      "mode": "approval_required",
      "memoryScope": "/",
      "toolAllow": [
        "Read",
        "Grep",
        "Glob",
        "Bash"
      ],
      "toolDeny": [],
      "metadata": {},
      "budget": {
        "perTask": {
          "tokens": 20000,
          "iterations": 8
        },
        "perDay": {
          "tokens": 200000,
          "iterations": 64
        }
      }
    }
  ],
  "updatedAt": "2026-09-17T06:40:00.000Z"
}
